,Image,Text
938,AHTD3A0289_Para3_1.png,ويرى بعض العلماء إن تاجك و تجك و تازك هي من الأصل المتقدم  من أصل لفظة طيء ولكلمة
939,AHTD3A0289_Para3_2.png,تازي في الفارسية معنى صحراوي من تاز  بمعنى الأرض المقفرة الخاليةولذلك نسب بعض الباحثين
940,AHTD3A0289_Para3_3.png,كلمة تازي إلى هذا المعنى فقالوا إنها أطلقت على العرب لما اشتهر عنهم أنهم صحراويون
941,AHTD3A0290_Para2_1.png,وبعض هذه التسميات المذكورة لا يزال حيا مستعملا ولكنه لم يبلغ
942,AHTD3A0290_Para2_2.png,لفظة عرب في الشهرة و الانتشار  فقد صارت لفظة عرب علما
943,AHTD3A0290_Para2_3.png,على قومية وجنس معلوم له موطن معلومله موطن معلوم وله لسان
944,AHTD3A0290_Para2_4.png,خاص به يميزه عن سائر الألسنة  من بعد الميلاد حتى اليوم
945,AHTD3A0290_Para2_5.png,وقد وسع الإسلام رقعة بلاد العرب كما وسع مجال اللغة العربية
946,AHTD3A0290_Para3_1.png,ورب سائل يقوللقد كان للعرب قبل الإسلام لغات مثل المعينية
947,AHTD3A0290_Para3_2.png,والسبئية و الحمرية والصفوية والثمودية واللحيانية وأمثالها اختلفت
948,AHTD3A0291_Para2_1.png,فإذا سيكون موقفنا من أصحاب هذه اللغات أنعدهم عربا والجواب إن
949,AHTD3A0291_Para2_2.png,هؤلاء وإن اختلفت لغتهم عن لغتنا وباينت ألسنتهم ألست فإنهم
950,AHTD3A0291_Para2_3.png,عرب لحما ودما ولدوا ونشأوا في بلاد العرب لم يرسوا إليها
951,AHTD3A0291_Para2_4.png,من الخارج ولم يكونوا طارئين عليها من أمة غريبة  فهم إذ
952,AHTD3A0291_Para2_5.png,عرب مثل غيرهم و لغات العرب هي لغات عربية وإن اختلفت وتباينت
953,AHTD3A0291_Para3_1.png,وحكمنا هذا ينطبق على النبط أيضا وعلى من كان على شاكلتهم عدهم
954,AHTD3A0291_Para3_2.png,علماء النسب والتاريخ واللغة والأخبار من غير العرب وأبعدوهم
955,AHTD3A0291_Para3_3.png,العرب والعربيةفقد كان أولئك وهؤلاء عربا أيضا مثل عرب
956,AHTD3A0291_Para3_4.png,اليمن المذكورين ومثل ثمود والصفويين واللحيانيين
957,AHTD3A0291_Para3_5.png,لهم لهجاتهم الخاصة  وإن تأثروا بالإرمية وكتبوا بها فقد تكلم
958,AHTD3A0292_Para2_1.png,وسترد في بحثنا عن تاريخ الجاهلية أسماء قبائل عربية كثيرة عديدة لا عهد
959,AHTD3A0292_Para2_4.png,الشك في أصل بعض القبائل المذكورة في كتب اليهود أو في مؤلفات
960,AHTD3A0292_Para2_5.png,الكتبة الكلاسيكيين على اعتبار أفها أخطأت في إدخالها
961,AHTD3A0292_Para2_6.png,في جماعة العرب
962,AHTD3A0292_Para3_1.png,العرب الذين تعارف العلماء الإسلاميون على اعتبارهم عربا فمنحوهم
963,AHTD3A0292_Para3_2.png,شهادة العروبة بحسب طريقتهم في تقسيمهم إلى طبقات وفي
964,AHTD3A0292_Para3_3.png,وضعهم في أشجار نسب ومخططات والعرب المجهولين الذين لم
965,AHTD3A0292_Para3_4.png,يمنحوا هذه الشهادة بل حرموا منها ونص على إخراجهم من العرب
966,AHTD3A0292_Para3_5.png,كالنبط على ما ذكرت والعرب المجهولين كل الجهل الذين لم يكن للمسلمين
967,AHTD3A0292_Para3_6.png,علم ما بهم
968,AHTD3A0293_Para2_1.png,سئل أحد علماء العربية عن لسان حمير فقال ما لسان حمير وأقاصي اليمن
969,AHTD3A0293_Para2_3.png,من عروبة غيرهم ممن كان يتكلم بلسان آخر مخالف للساننا بل عدوهم
970,AHTD3A0293_Para2_4.png,من صميم العرب ومن لبها ونحن هنا لا نستطيع إن ننكر على الأقوام
971,AHTD3A0294_Para3_1.png,أما حدها الغربي فارض الحضر في بلاد الشام  وتدخل في العربية بادية فلسطين و
972,AHTD3A0294_Para3_2.png,طور سيناء إلى شواطئ النيل  وقد أطلق بعض الكتاب اليونان على الأرضين الواقعة
973,AHTD3A0294_Para3_3.png,شرق ال  أي الخابور اسم  كما أدخل هيرودوتس أرض طور سيناء إلى شواطئ
974,AHTD3A0294_Para3_4.png,نهر النيل في العربية أي بلاد العرب
975,AHTD3A0295_Para2_1.png,أما الآن وقد عرفنا لفظة عرب و كيف تحددت وتطورت
976,AHTD3A0295_Para2_2.png,أرى لزاما علينا الدخول في صلب موضوعنا وهو تاريخ العرب
977,AHTD3A0295_Para2_3.png,مبتدئين بمقدمة عن الجاهية وعن المواود التي استقينا منها
978,AHTD3A0295_Para2_4.png,أخبارها  ثم بمقدمات عن جزيرة العرب وعن صبيعتها وعن
979,AHTD3A0295_Para2_5.png,الساميين وعقليتهم وعن العقلية العربية تليها بحوث
980,AHTD3A0295_Para2_6.png,في أنساب العرب ثم ندخل بعد ذلك في التاريخ السياسي للعرب
981,AHTD3A0295_Para3_1.png,ولما كان الإسلام أعظم حادث نجم على الإطلاق في تاريخ
982,AHTD3A0295_Para3_2.png,العرب أخرجهم من بلادهم إلى بلاد أخرى واسعة فسيحة
983,AHTD3A0295_Para3_5.png,أيام عرفت ب الجاهلية وبداية عهد عرف ب الإسلام
984,AHTD3A0296_Para2_2.png,الجاهلي أو تأريخ الجاهلية وان يذهبوا إلى إن العرب
985,AHTD3A0296_Para2_6.png,أميون عبدة أصنام
986,AHTD3A0296_Para3_1.png,و الجاهلية اصطلاح مستحدث ظهر بظهور الإسلام وقد أطلق
987,AHTD3A0296_Para3_2.png,على حال قبل الإسلام تمييزا وتفريقا لها عن الحالة التي صار عليها
988,AHTD3A0296_Para3_5.png,الموجودة بعد ظهور أحداث تزلزلها وتتمكن منها وذلك لتمييزها
989,AHTD3A0302_Para2_1.png,أغلب الكتابات الجاهلية التي عثر عليها هي و للأسف في أمور شخصية
990,AHTD3A0302_Para2_2.png,ولذلك انحصرت فوائدها في نواح معينة في مثل الدراسات اللغوية وأقلها
991,AHTD3A0302_Para2_3.png,النصوص التي تتعرض لحالة العرب للسياسية أو الأحوال الاجتماعية
992,AHTD3A0302_Para2_4.png,أو العلمية  أو الدينية أو النواحي
993,AHTD3A0302_Para3_1.png,بل حتى النصوص العربية الجنوبية التي عثر عليها حتى الآن عثر
994,AHTD3A0302_Para3_4.png,أفادتنا مع ذلك فائدة كبيرة في تدوين تاريخ العرب الجنوبيين
995,AHTD3A0304_Para3_1.png,والكتابات المؤرخة قليلة  هذا أمر يؤسف عليه إذ يكون المؤرخ في حيرة من أمره في
996,AHTD3A0305_Para2_1.png,والكتابات المؤرخة بهذه الطريقة وان كانت أحسن حالا من الكتابات
997,AHTD3A0307_Para3_1.png,أو إنها كانت تتبدل بتبدل الرجال  والرأي الغالب هو إنها وضعت في وضع يلائم المواسم وأوقات
998,AHTD3A0308_Para2_2.png,قامت فيها الدولة الحميرية على رأي بعض  العلماء فأخذ الحميريون يؤرخون بهذا
999,AHTD3A0308_Para2_3.png,الحادث و اعتدوه مبدأ لتقويمهم  وقد درسه المستشرقون فوجدوه يقابل
1000,AHTD3A0308_Para3_1.png,ومن النصوص المؤرخة نص تأريخه سنة من سني التقويم الحميري  وإذا ذهبنا
1001,AHTD3A0308_Para3_4.png,سبأ وذو ريدان و ابنه شمر يهرعش  وللملك ياسر يهنعم نص آخر
1002,AHTD3A0309_Para3_1.png,ولما أراد الملك شرحبيل يعفر بن أبي كرب أسد ملك
1003,AHTD3A0310_Para2_4.png,السد و إصلاحه في عام  الحميري
1004,AHTD3A0311_Para2_1.png,هذا وإن مما يلاحظ على الكتابات العربية الجنوبية أن التي ترجع منها إلى العهود القديمة من
1005,AHTD3A0311_Para2_2.png,تاريخ جنوب بلاد العرب قليلة  وكذلك الكتابات التي ترجع إلى العصور الحميرية المتأخرةأي
1006,AHTD3A0311_Para2_3.png,القريبة المتصلة بالإسلام  ولذلك أصبحت أكثر الكتابات التي عثر عليها حتى الآن من العهود
1007,AHTD3A0311_Para2_4.png,الوسطى المحصورة بن أقسم عهد من عهود تأريخ اليمن
1008,AHTD3A0314_Para2_1.png,ثم ذكر أنهم أرخوا أيضا بما كان يقع لديهم من أحدا جسيمة في نظرهم مثل نار صوان وهي نار
1009,AHTD3A0314_Para2_2.png,كانت تظهر ببعض الحرار من أقاصي بلاد اليمن ومثل الحروب التي وقعت بين القبائل والأيام
1010,AHTD3A0314_Para3_1.png,وقد ذكر المسعودي أن قدوم أصحاب الفيل مكة كان يوم الأحد لسبع عشرة ليلة خلت من المحرم
1011,AHTD3A0314_Para3_3.png,أوله حجة العدد حجة الغدر ولسنة أربعين من ملك كسرى أنوشروان
1012,AHTD3A0314_Para3_4.png,ولم يشر المسعودي إلى العرب الذين أرخوا بالتقويم المذكور
1013,AHTD3A0315_Para2_2.png,على ما فيها من خطأ أهمية كبيرة لأنها وردت فيها أخبار تاريخية وجغرافية كبيرة الخطورة
1014,AHTD3A0315_Para2_3.png,ووردت فيها أسماء قبائل عربية كثيرة لولاها لم نعرف عنها شيئا وقد استقى مؤلفوها وأصحابها
1015,AHTD3A0315_Para2_4.png,معارفهم من الرجال الذين اشتركوا في الحملات التي أرسلها اليونان أو الرومان إلى بلاد العرب
1016,AHTD3A0315_Para3_1.png,ومن السياح الذين اختلطوا بقبائل بلاد العرب  ولا سيما في بلاد الأنباط من التجار وأصحاب
1017,AHTD3A0316_Para2_1.png,وأقصد بالكتب  الكلاسيكية الكتب اليونانية واللاتينية
1018,AHTD3A0316_Para2_7.png,أو الرومان إلى بلاد العرب
1019,AHTD3A0319_Para2_1.png,وبرى بعض الباحثين أن ما ذكره بطلميوس عن حضرموت يشير إلى أن
1020,AHTD3A0321_Para2_1.png,والموارد المذكورة كثيرة منها مصنفات في التاريخ
1021,AHTD3A0321_Para2_3.png,البلدان والرحلات والجغرافيا وفي موضوعات أخرى عديدة هي وإن كانت
1022,AHTD3A0321_Para2_4.png,في أمور لا تعد من صميم التاريخ إلا أنها مورد من الموارد التي يجب
1023,AHTD3A0321_Para2_5.png,الاستعانة بها في تدوين تاريخ الجاهلية لأنها تتضمن مادة غزيرة
1024,AHTD3A0321_Para2_6.png,تتعلق بتاريخ الجاهلية القريبة من الإسلام والمتصلة به
1025,AHTD3A0321_Para3_1.png, إننا إذا أردنا البحث عن مورد يصور لنا أحوال الحياة الجاهلية
1026,AHTD3A0321_Para3_2.png,ويتحدث لنا عن تفكير أهل الحجاز عند ظهور الإسلام فلا بد
1027,AHTD3A0321_Para3_6.png,كتابا عربيا
1028,AHTD3A0331_Para2_1.png,وفي كتب الأدب ثروة تأريخية قيمة مبثوثة في صفحاتها لا تجد لها مثيلا ولا
1029,AHTD3A0331_Para2_2.png,مكانا في كثير من الأحايين في كتب أهل التأريخ عن التاريخ الجاهلي
1030,AHTD3A0331_Para2_3.png,حتى اني لأستطع أن أقول إن ما أورده رجال الأدب عنه هو أضعاف
1031,AHTD3A0331_Para2_4.png,أضعاف ما رواه المؤرخون عن ذلك التاريخ وأن ما جاءت به
1032,AHTD3A0331_Para2_5.png,كتب الأدب عن ملوك الحيرة وعن الغساسنة
1033,AHTD3A0331_Para3_1.png,وعن ملوك كندة وعن أخبار القبائل العربية هو أكثر بكثير مما جاءت
1034,AHTD3A0331_Para3_2.png,به كتب التأريخ بل هو أحسن منها عرضا وصفاء وأكثر منها دقة  ويدل عرضه
1035,AHTD3A0331_Para3_3.png,بأسلوبه الأدبي المعروف على أنه مستمد من موار عربية خالصة وقد أخذ من
1036,AHTD3A0331_Para3_4.png,أفواه شهود عيان شهدوا ما تحدثوا عنه  وقد أفادنا كثيرا
1037,AHTD3A0331_Para3_5.png,في تدوين تأريخ الجاهلية الملاصقة للإسلام
1038,AHTD3A0332_Para2_1.png,وقد صارت كتب المؤرخين المسلمين لذلك ضعيفة جدا في باب تأريخ العرب قبل الإسلام
1039,AHTD3A0332_Para2_2.png,ومادتها عن الجاهلية هزيلة جد قليلة بالقياس إلى ما نجده في كتب التفسير
1040,AHTD3A0332_Para2_3.png,والحديث والفقه والأدب وشروح دواوين الشعراء الجاهليين والمخضرمين
1041,AHTD3A0332_Para3_1.png,مع ذكر بعض ما وقع لهم بعض الأحيان على حين تجد كتب الأدب تتبسط
1042,AHTD3A0332_Para3_2.png,في الحديث عنهم وتتحدث عن حوادث وأمور لا نجد لها ذكرا في كتب
1043,AHTD3A0332_Para3_3.png,المؤرخين بل نجد فيها أسم ملوك لم تعرفها كتب التاريخ
1044,AHTD3A0343_Para2_1.png,ومنهم من برز وألف في  موضوعات دينية وتارخية كما ورد في أخبار أهل
1045,AHTD3A0343_Para2_2.png,الحرة كانوا يتداولون قصص رستم واسفنديار وملوك فارس وأن النصر بن الحارث الذي كان
1046,AHTD3A0343_Para2_3.png,يعارض الرسول تعلم منهم وكان يحدث أهل مكة بأخبارهم معارضا رسول الله
1047,AHTD3A0344_Para2_1.png,ولقد قال كولد تزهير و بروكلمن بوجود أثر فارسي في ظهور علم التأريخ عند المسلمين
1048,AHTD3A0344_Para2_2.png,أما أثر الموارد الفارسية في مادة الفصول المدونة عن الفرس وعن ملوك الحيرة
1049,AHTD3A0344_Para2_3.png,فواضح ظاهر ولا يمكن لأحد الشك فيه و أما أثرها فيما عدا ذلك ولا سيما
1050,AHTD3A0344_Para2_4.png,في كيفية عرض التاريخ وفي أسلوب تدوينه وتبويبه فدعوى أراها غير صحيحة
1051,AHTD3A0344_Para3_1.png,أن طريقة الابتداء بالزمان ثم ابتداء الخلق وعدد أيام الخلق وخلق آدم ثم التحدث
1052,AHTD3A0344_Para3_2.png,عن الأنبياء بحسب تسلسل رسالاتهم وهي الطريقة التي سار عليها من دون في
1053,AHTD3A0344_Para3_3.png,التأريخ العام من المسلمين مثلا فعل الطبري في تأريخه طريقة لا يمكن أن تكون
1054,AHTD3A0344_Para3_4.png,فارسية لأن الفرس مجوس والمجوس لا يعتقدون بهؤلاء الرسل والأنبياء
1055,AHTD3A0345_Para2_1.png,والصحيح إنها طريقة المؤرخين الذين جاؤوا بعد الميلاد فهم الذين رو جوا الأسلوب المذكور تدوين التاريخ
1056,AHTD3A0346_Para2_1.png,وحتى القسم المتصل منه بالتأريخ قد وضع بأسلوب عاطفي أدبي  ومن هنا ابتعد عن
1057,AHTD3A0347_Para2_1.png,ويكاد يكون أكر ما دون عن الغساسنة في المؤلفات العربية الإسلامية مأخوذا من الروايات
1058,AHTD3A0347_Para2_2.png,الواردة عن ملوك الحيرة وعرب الحيرة أنداد الغساسنة ولذلك لم تكن في جانبهم وتكاد
1059,AHTD3A0347_Para2_3.png,تلك الأخبار ترجع في الغالب إلى شخص واحد تخصص بأخبار الحيرة وملوك الفرس
1060,AHTD3A0347_Para2_4.png,هو هشام بن محمد بن السائب الكلبي
1061,AHTD3A0347_Para3_1.png,وهو الذي روى هذه الأخبار اعتمادا على بحوثه الخاصة وعلى البحوث و الدراسات التي قام
1062,AHTD3A0347_Para3_2.png,بها والده من قبله  ويجب أن نجعل لهذه الملاحظات الاعتبار الأول في تدوين تاريخ
1063,AHTD3A0347_Para3_3.png,الغساسنة  وقد وردت أخبارهم في الطبري مع أخبار ملوك الحيرة والفرس لهذا السبب
1064,AHTD3A0347_Para3_4.png,و أما في سائر الأصول التاريخية الأخرى فهي مقتضبة
1065,AHTD3A0348_Para2_1.png,وشد اكتفى بعض المؤرخين بإيراد جريدة بأسماء الملوك وهو
1066,AHTD3A0348_Para2_3.png,فإننا نجد في كتب الأدب وفي دواوين الشعر عونا لنا في
1067,AHTD3A0348_Para2_4.png,تدوين تاريخ غسان قد يسد بعض الفراغ في تاريخ هذه
1068,AHTD3A0348_Para2_5.png,الإمارة وان كان ذلك كد لا يكفي بل لابد من
1069,AHTD3A0348_Para2_6.png,الاستعانة بأصول أعجمية
1070,AHTD3A0348_Para3_1.png,ففيها مواد عن نواح مجهولة من هذا التاريخ كما أنها تصحح
1071,AHTD3A0348_Para3_2.png,شيئا مما ورد في الموارد العربية مهن أغلاط  ولقد تأثرت
1072,AHTD3A0348_Para3_4.png,لاعتماده على روايات أهل الحيرة وعلى أهل الكوفة في سرد
1073,AHTD3A0348_Para3_6.png,الغساسنة ولهذا تتعارض رواياته
1074,AHTD3A0349_Para2_1.png,ولهذا تتعارض رواياته وروايات من استقى من هذا المورد مع روايات علماء
1075,AHTD3A0349_Para2_2.png,اللغة والأدب والشعر الني وردت استطرادا عن أهل الحيرة
1076,AHTD3A0349_Para2_3.png,أو الغساسنة وذلك في أثناء شرحهم لفخمة أو بيت شعر أو قصيدة
1077,AHTD3A0349_Para2_4.png,أو ديوانا أو حياة شاعر كانت له علاقة بالحيرة أو بالغساسنة أو عن قصة
1078,AHTD3A0349_Para3_1.png,أما روايات أهل يثرب أي المدينة فهي في مصلحة الغساسنة في الأكثر
1079,AHTD3A0349_Para3_2.png,وقد كانوا على اتصال دائم بهم ولهم تجارات معهم وكان شعراؤهم يفتخرون بانتسابهم
1080,AHTD3A0349_Para3_3.png,هم وآل غسان إلى أصل واحد و دوحة واحدة هي الأزد  وهذا يستحسن
1081,AHTD3A0349_Para3_4.png,التفكر في هذا الأمر بالنسبة إلى روايات أهل المدينة ولا سيما أخبار حسان بن ثابت
1082,AHTD3A0351_Para2_1.png,هذا المدون عن قبل الإسلام والذي صار مقدمة لتاريخ الإسلام عرج المشتغلون في التأريخ
1083,AHTD3A0351_Para2_2.png,العام على وضعها قبل تاريخ الرسالة  وقد استفاد من بعضها بعض المؤرخين مثل المسعودي
1084,AHTD3A0351_Para2_3.png,وحمزة الأصفهاني وآخرين في تدوين تاريخ ملوك الروم وقد صارت طريقتهم كما
1085,AHTD3A0351_Para2_4.png,قلت سابقا أنموذجا للمؤرخين ساروا عليه في عرض التأريخ وفي تدوينه
1086,AHTD3A0351_Para3_3.png,وقد وضعت في ذلك جملة مؤلفات ضاع أكرها ويا للأسف ولم يبق منها إلا الاسمولكننا
1087,AHTD3A0351_Para3_4.png,في مع ذلك مادة غنية واسعة منها في كتب الأدب أستطيع أن أقول إنها أوسع
1088,AHTD3A0353_Para2_4.png,على الثروة الواردة في مؤلفات المؤرخين  وإهمال المؤرخين لتلك الموارد
1089,AHTD3A0353_Para2_5.png,هو  من أسباب الضعف التي   نبدها في فهمهم للمنابع
1090,AHTD3A0353_Para3_1.png,وإذا كان   القدامى قد أخطأوا في فهم معنى التاريخ ووقعوا من ثم في
1091,AHTD3A0353_Para3_2.png,خطأ بالنسبة إلى الموارد التي يجب أن يرجع إليها في تدوين تأريخ الجاهلية
1092,AHTD3A0353_Para3_4.png,مراجعة الموارد الأخرى من كتب في  التفسير وفي الحديث وفي الفقه
1093,AHTD3A0353_Para3_5.png,وفي الأدب وغير ذلك   لاستخراج ما فيها
1094,AHTD3A0355_Para2_1.png,فأما عبيد بن شرية فقد كان من أهل صنعاء في رواية أو من سكان الرقة في رواية أخرى
1095,AHTD3A0356_Para2_1.png,بعنوان أخبار عبيد بن شرية الجرهمي في أخبار اليمن وأشعارها وأنسابها وقد وضع
1096,AHTD3A0356_Para2_2.png,الكتاب على الطريقة التي تروى بها الأسمار وأيام العرب وفيه أشعار كثيرة
1097,AHTD3A0356_Para2_3.png,وضعت على لسان عاد وثمود ولقمان وطسم وجديس والتبابعة وفيه قصص
1098,AHTD3A0356_Para2_4.png,إسرائيلي وشعبي يمثل في جملته السذاجة وضعف ملكة النقد وبساطة القص و
1099,AHTD3A0356_Para2_5.png,القصة ومبلغ علم الناس
1100,AHTD3A0356_Para3_1.png,والطابع الظاهر على أخبار عبيد هو طابع السمر والقصص والأساطير المتأثرة
1101,AHTD3A0356_Para3_2.png,بالإسرائيليات  وأما الشعر الكثير الذي روي على أنه من نظم التبابعة وغيرهم
1102,AHTD3A0356_Para3_3.png,وفيه قصائد طويلة فلا ندري أمن نضمه أم من نظم أشخاص آخرين
1103,AHTD3A0356_Para3_4.png,قالوها على لسان من زعموا أنهم نظموها أو إنها أضيفت فيما بعد إلى الكتاب
1104,AHTD3A0356_Para3_5.png,ونسبت روايتها إلى عبيد
1105,AHTD3A0357_Para2_1.png,وأما وهب بن منيه فقد كان من أهل ذماروكان قاصا أخباريا من الأبناء
1106,AHTD3A0357_Para2_3.png,العربية  وقد زعم أنه كان ينقل من التوراة ومن كتب بني إسرائيل وانه كان يقول
1107,AHTD3A0357_Para2_4.png,قرأت من كتب الله تعالى اثنين وسيعين كتابا وانه كان يتقن اليونانية والسريانية والحمرية
1108,AHTD3A0357_Para3_4.png,سليمان بن داوود عليهما السلام فقراه
1109,AHTD3A0365_Para2_1.png,وهناك عدد آخر من العلماء كالأصمعي و الشرقي بن القطامي وسائر من اشتغل بالأنساب
1110,AHTD3A0365_Para2_2.png,واللغة والأدب كان لهم  فضل كبير في جمع  أخبار الجاهلية المتصلة بالإسلام وقد
1111,AHTD3A0365_Para2_3.png,تولدت من شروحهم و أماليهم وكتبهم ثروة تاريخية قيمة لم ترد في كتب التاريخ
1112,AHTD3A0365_Para2_4.png,ولكن عرض أسمائهم هنا وذكر بحوثهم ومؤلفاتهم يضطرنا إلى كتابة فصول طويلة
1113,AHTD3A0365_Para3_1.png,لقد بذل الهمداني مجهودا يقدر في تأليف كتبه وفي اختيار  موضوعاتهوسلك في
1114,AHTD3A0365_Para3_2.png,بحوثه سبيلا حسنا بذهابه بنفسه إلى الأماكن الأثارية وبوصفه لها في كتبه فأعطانا
1115,AHTD3A0366_Para3_1.png,ولخد أشار الهمداني نفسه إليهم وذكرهم بأسمائهم مثل أحمد بن الأغر الشهابي من كندة
1116,AHTD3A0366_Para3_2.png,و محمد ابن أحمد الأوساني و مسلمة بن يوسف بن مسلمة الحيواني وغيرهم  فهم مثله يستحقون
1117,AHTD3A0366_Para3_3.png,الثناء والتقدير أيضا وهم بطريقتهم هذه في جمع مادة التأريخ يكونون على شاكلة الآثاريين
1118,AHTD3A0366_Para3_4.png,المحدثين في إدراك أهمية الدراسات الآثار
1119,AHTD3A0367_Para2_1.png,وقد أثنى الهمداني بصورة خاصة على أستاذ له أخذ منه فوسمه بأنه شيخ حمير
1120,AHTD3A0367_Para2_2.png,وناسبها وعلامتها وحامل سفرها ووارث ما ادخرته ملوك حمير خزائنها من
1121,AHTD3A0367_Para3_1.png,والمنبع الذي غرف منه علمه بأحوال الماضين إلى أن قال وكان
