,Image,Text
0,AHTD3A0001_Para2_3.png,من العذاب في الآخرة وأفضل ما رزقهم الله تعالى ومن به عليهم بالعقل الذي هو دعامة
1,AHTD3A0001_Para2_4.png,لجميع الأشياء والذي لا يقدر أحد في الدنيا على إصلاح معيشته
2,AHTD3A0001_Para3_1.png,فقال له  إنك في منازل آبائك وأجدادك من الجبابرة الذين أسسوا الملك
3,AHTD3A0001_Para3_2.png,قبلك وشيدوه دونك وبنوا القلاع والحصون ومهدوا البلاد وقادوا الجيوش
4,AHTD3A0002_Para2_1.png,وكذلك طالب الآخرة مجتهد في العمل المنجي به روحه لا
5,AHTD3A0002_Para2_2.png,يقدر على إتمام عمله و الحماله إلا بالعقل الذي هو سبب كل خير
6,AHTD3A0002_Para2_3.png,ومفتاح كل سعادة  فليس لأحد غني عن العقل  والعقل
7,AHTD3A0002_Para2_4.png,مكتسب بالتجارب والأدب  وله غريزة مكنونة في الإنسان
8,AHTD3A0002_Para3_1.png,وعلى العالم أن يبدأ بنفسه ويؤدبها بعلمه ولا تكون غايته
9,AHTD3A0002_Para3_2.png,اقتناؤه العلم لمعاونة غيره ويكون كالعين التي يشرب منها
10,AHTD3A0002_Para3_3.png,الناس ماءها وليس لها في ذلك شيء من المنفعة
11,AHTD3A0002_Para3_4.png,وكدودة القز التي تحكم صنعته ولا تنتفع به  فينبغي
12,AHTD3A0002_Para3_5.png,لمن يطلب العلم أن يبدأ بعظة نفسه ثم عليه بعد ذلك
13,AHTD3A0002_Para3_6.png,أن يقبسه
14,AHTD3A0004_Para2_1.png,وقد ينبغي للناظر في كتابنا هذا ألا تكون غايته التصفح لتزاويقه  بل
15,AHTD3A0004_Para2_2.png,يشرف على ما يتضمن من الأمثال حتى ينتهي منه ويقف عند كل مثل وكلمة
16,AHTD3A0004_Para2_4.png,المال الكثير قتنازعوه بينهم فأما الكبيران فإنهما أسرعا في إتلافه وإنفاقه
17,AHTD3A0004_Para2_5.png,في غير وجهه
18,AHTD3A0004_Para3_1.png,وأما الصغير فإنه عندما نظر ما صار إليه أخواه من إسرافهما وتخليهما من المال
19,AHTD3A0004_Para3_2.png,اقبل على نفسه يشاورها وقال يا نفسي إنما المال يطلبه صاحبه ويجمعه
20,AHTD3A0004_Para3_3.png,من كل وجه لبقاء حاله وصلاح معاشه ودنياه وشرف منزلته في أعين
21,AHTD3A0004_Para3_4.png,الناس واستغنائه عما في أيديهم وصرفه في وجهه من صلة الرحم  والإفضال
22,AHTD3A0004_Para3_5.png,على الإخوان
23,AHTD3A0005_Para2_2.png,فرأيت أن أطلب الاشتغال بالطب ابتغاء الآخرة لئلا أكون كالتاجر الذي باع
24,AHTD3A0006_Para2_1.png,فأقبلت على مداواة المرضى ابتغاء أجر الآخرة فلم أدع
25,AHTD3A0006_Para2_3.png,أن يخف عنه بعض المرض إلا بالغت في مداواته 
26,AHTD3A0006_Para2_4.png,ما أمكنني القيام عليه بنفسي ومن لم أقدر على القيام عليه
27,AHTD3A0006_Para2_5.png,وصفت له ما يصلح وأعطيته من الدواء ما يعالج به
28,AHTD3A0006_Para3_1.png, ولم أرد ممن فعلت معه ذلك جزاء  ولم أغبط أحدا
29,AHTD3A0006_Para3_2.png,من نظرائي الذين هم دوني في العلم وفوقي في الجاه
30,AHTD3A0006_Para3_3.png,والمال وغيرهما مما لا يعود بصلاح ولا حسن سيرة قولا ولا عملا
31,AHTD3A0006_Para3_5.png,فقلت يا نفس أما تعرفين نفعك من ضرك
32,AHTD3A0009_Para3_1.png,وكأن الدنيا جذلة مسرورة تقول قد جبت الخيرات وأظهرت السيئات  فلما فكرت في الدنيا وأمورها وأن الإنسان هو أترف
33,AHTD3A0009_Para3_2.png,الخلق فيها وأفضله ثم هو لا يتقلب إلا في الشرور و اطعم عرفت أنه ليس إنسان ذو عقل يعلم ذلك ثم لا يحتال لنفسه
34,AHTD3A0009_Para3_3.png,في النجاة فعجبت من ذلك كل العجب
35,AHTD3A0010_Para2_1.png,إن طبائع الخلق مختلفة  وليس مما خلقه الله في الدنيا مما يمشي على أربع
36,AHTD3A0010_Para2_2.png,أو على رجلين أو يطير بجناحين شيء هو  أفضل من الإنسان
37,AHTD3A0010_Para2_3.png,ولكن من الناس البر والفاجر  وقد يكون في بعض البهائم والسباع
38,AHTD3A0010_Para2_4.png,والطير ما هو أوفى منه ذمة وأشد محاماة على حرمه وأشكر
39,AHTD3A0010_Para2_5.png,للمعروف وأقوم به
40,AHTD3A0010_Para3_1.png,وقد يأخذ ابن عرس فيدخله في كمه ويخرجه من الآخر كالذي يحمل
41,AHTD3A0010_Para3_4.png,ما يصنع إليهم على قدر ما يرى منهم
42,AHTD3A0011_Para2_1.png,إن طبائع الخلق مختلفة وليس مما خلقه الله في الدنيا مما يمشي على أربع أو على رجلين
43,AHTD3A0011_Para3_1.png,وقد يأخذ ابن عرس فيدخله في كمه ويخرجه من الآخر كالذي يحمل الطائر على يده فإذا صاد شيئا انتفع
44,AHTD3A0012_Para2_1.png,الصين هي أكبر دولة منتجة للأجهزة الكهربائية المنزلية في العالم وفي عام الفين وسبعه
45,AHTD3A0012_Para2_2.png,بلغت قيمة صادراتها من التلفزيونات والثلاجات  والغسالات والهواتف النقالة
46,AHTD3A0012_Para2_3.png,ما يقارب ثمانيه وخمسين مليار دولار أمريكي  بيد أن الفائض الكبير الذي تحققه الصين في تجارتها
47,AHTD3A0012_Para2_4.png,الخارجية أثار احتكاكات تجارية بينها وبين بعض الدول وخاصة المصدرة
48,AHTD3A0012_Para3_1.png,ولا شك أن ارتفاع قيمة الصادرات ساهمت كثيرا في نمو الاقتصاد الصيني غير أن قيمة الصادرات
49,AHTD3A0012_Para3_2.png,الصينية تتراجع بسبب الأزمة المالية العالمية ولهذا توجهت شركات الأجهزة الكهربائية
50,AHTD3A0012_Para3_3.png,المنزلية الصينية إلى أسواق الريف الصيني في محاولة لتعويض خسارتها الناجمة عن تراجع
51,AHTD3A0012_Para3_4.png,الصادرات  هذه التحليلات والاستراتيجيات الاقتصادية لا تعني شيئا بالنسبة  لمن
52,AHTD3A0012_Para3_5.png,يقطن قرية نائية
53,AHTD3A0013_Para2_1.png,عندما بدأ تطبيق مشروع وصول الأجهزة الكهربائية المنزلية إلى الريف في مدينة لينيي
54,AHTD3A0014_Para3_1.png,تقول تشنغ رو هونغ  سنة الناس حاليا يهتمون بنوعية حياتهم ويعيشون بطريقة
55,AHTD3A0014_Para3_4.png,تتوفر لها الظروف المادية الكافية ونمط الحياة الجيد
56,AHTD3A0015_Para2_1.png,ويعتقد الخبير السكاني تسنغ يي بينغ  الأستاذ في جامعة بكين أن
57,AHTD3A0015_Para2_2.png,عملية التصنيع سبب لتأخير سن الإنجاب  ويقول اختفى الاقتصاد
58,AHTD3A0015_Para2_3.png,الأسري التقليدي وتغير   نمط الإنتاج كليا وأصبح التعليم عملية
59,AHTD3A0015_Para2_4.png,ممتدة طويلة حيث يقضي الفرد وقتا أطول لاكتساب مهارات الحياة
60,AHTD3A0015_Para2_5.png,وتدبير المال استعدادا الإنجاب فتختار النساء الإنجاب في سن كبيرة
61,AHTD3A0015_Para3_1.png,ويرى تونغ شين الأستاذ بكلية العلوم الاجتماعية في جامعة بكين أن
62,AHTD3A0015_Para3_2.png,تأخير سن الإنجاب يرتبط بارتفاع مكانة النساء في المجتمع  مع ارتفاع المستوى
63,AHTD3A0015_Para3_3.png,التعليمي للمرأة لم يعد دورها في المجتمع مجرد وسيلة للتكاثر  لم تعد المرأة
64,AHTD3A0015_Para3_4.png,بحاجة إلى تثبيت مكانتها في الأسرة عن طريق الإنجاب فقد ضعف مفهوم
65,AHTD3A0015_Para3_5.png,التكاثر في المجتمع
66,AHTD3A0016_Para2_1.png,تقول لو دي الموظفة في شركة أجنبية يعتقد غالبية الناس حاليا أنهم يعيشون
67,AHTD3A0016_Para2_2.png,من أجل أنفسهم فقط وهذا الرأي هو التيار الرئيسي في المجتمع  تشعر لو دي بالندم لأنها
68,AHTD3A0016_Para2_3.png,أصبحت أما  وتغبط الحوامل الكبيرات السن لأن بوسعهن أن يعملن وقتا
69,AHTD3A0016_Para2_4.png,أطول بما يساعدهن على تحقيق طموحاتهن والاستمتاع بفترة شبابهن
70,AHTD3A0016_Para3_2.png,يي تأخير سن الإنجاب يؤدي إلى انخفاض معدل الإنجاب  لم يكن تأخير سن
71,AHTD3A0016_Para3_3.png,الإنجاب يمثل مشكلة عندما كان معدل الإنجاب عاليا ولكن مع انخفاض معدل
72,AHTD3A0016_Para3_4.png,الإنجاب صار تأخير سن الإنجاب مشكلة في هذا العصر تماما وموكدا
73,AHTD3A0017_Para2_1.png,تغير مفهوم الإنجاب عند الصينيين في الريف أيضا مع هجرة كثير من أهل
74,AHTD3A0017_Para2_2.png,الريف إلى المدن للعمل لفترة ثم العودة إلى قراهم حيث انخفض معدل
75,AHTD3A0017_Para2_3.png,الإنجاب في المناطق الريفية كثيرا وقد كشف استبيان حول مفهوم الإنجاب
76,AHTD3A0017_Para2_4.png,عن وجود اختلاف واضح بين الريفيات اللاتي عملن في المدن واللاتي
77,AHTD3A0017_Para2_5.png,لم يغادرن الريف
78,AHTD3A0017_Para3_1.png,فالمجموعة الأولى تفضل الإنجاب في سن متأخرة وتباعد فترات الحمل وإنجاب
79,AHTD3A0017_Para3_2.png,عدد قليل من الأطفال بل طفل واحد  وفي معظم الأحوال يؤخر ويفضل
80,AHTD3A0017_Para3_3.png,الفلاحون الذين يعملون في المدن سن الزواج وسن الإنجاب  فالخروج إلى
81,AHTD3A0017_Para3_4.png,العمل يساعد على تقليل الإنجاب  منذ أن تبنت الصين سياسة الإصلاح
82,AHTD3A0017_Para3_5.png,والانفتاح قبل ثلاثين سنة
83,AHTD3A0019_Para2_1.png,يكون على الأسرة مساعدة الشاب الريفي الذي يبقى في الريف عندما يتزوج أو يبني
84,AHTD3A0021_Para2_1.png,كان تشه شينغ لاى الذي سينهي في يونيو هذا العام دراسة الدكتوراه في الفيزياء بجامعة تشينغهوا يهمهم وهو خارج
85,AHTD3A0021_Para2_2.png,من ملتقى للتوظيف أقيم في القاعة الرياضية الثانية لجامعة بكين مترددا لم أجد شيئا  لا يختلف حال تشه
86,AHTD3A0021_Para2_3.png,عن معظم الخريجين الذين يدورون بين ملتقيات ومعارض التوظيف منذ بداية هذه السنة الدراسية
87,AHTD3A0021_Para3_1.png,أمنية تشه شينغ لاى أن يعمل بالتدريس في جامعة وقد نال بالفعل بغيته حيث قبلته جامعة في مدينة تشينهوانغدوا
88,AHTD3A0021_Para3_2.png,بمقاطعة خبي ولكن لأن صديقته  تعمل في بكين يأمل الشاب أن يكون مكان العمل قريبا الصديقة
89,AHTD3A0021_Para3_3.png,لهذا لم يتوقف عن الذهاب إلى ملتقيات التوظيف  قال تشه في السابق لم يكن  عسيرا
90,AHTD3A0024_Para3_1.png,فنتيجة للأزمة المالية العالمية قللت كثير من الشركات الأجنبية لدى الصين عدد العاملين
91,AHTD3A0024_Para3_2.png,بها أو خفضت  رواتبهم أو حتى استغنت عنهم تماما  في الوقت ذاته
92,AHTD3A0024_Para3_3.png,صار العمل في الوحدات الحكومية هو الأكثر تفضيلا  وكما قال تانغ يوان التي تدرس المالية في
93,AHTD3A0024_Para3_4.png,جامعة رنمين الصينية وضع توظيف خريجي تخصص المالية حاليا غير جيد
94,AHTD3A0025_Para2_1.png,أصدرت شركة شانغهاى المحدودة للخدمات الخارجية تقريرا حول التوظيف
95,AHTD3A0025_Para2_2.png,في الصين سنة الفين وثمانية جاء فيه أن العمل في الوحدات الحكومة
96,AHTD3A0025_Para2_3.png,هو أفضل عمل للخريجين الصينيين  وتصديقا لما جاء في التقرير سجل نحو مليون و
97,AHTD3A0025_Para2_4.png,أربعين ألف فرد أسماءهم للمشاركة في الامتحان الوطني للعمل في الحكومة
98,AHTD3A0025_Para2_5.png,وذلك لعام الفين وتسعه
99,AHTD3A0026_Para3_2.png,من الموظفين مواكبة للاحتياجات الاستراتيجية للدولة وتقول إنه مع توقعات النمو المتواصل للاقتصاد الصيني بمعدلات
100,AHTD3A0027_Para2_1.png,خلال جولة له في جامعة بكين للطيران والفضاء سنة الفين وثمانية قال رئيس مجلس الدولة ون
101,AHTD3A0027_Para2_2.png,جيا باو إن الحكومة الصينية ستنفذ قريبا سلسلة من الإجراءات المشجعة لتوظيف خريجي الجامعات
102,AHTD3A0027_Para2_3.png,من بينها تهيئة الظروف التي تمكن المؤسسات الكبيرة وخاصة مؤسسات الابتكار  الذاتي من
103,AHTD3A0027_Para2_4.png,توظيف عدد أكبر من خريجي الجامعات
104,AHTD3A0027_Para3_1.png,في هذا الإطار بدأت وزارة التربية والتعليم الصينية بالتعاون مع وزارة السكك
105,AHTD3A0027_Para3_2.png,الحديدية ووزارة التجارة الصينية وغيرها من عشر وزارات من نوفمبر عام الفين وثمانية
106,AHTD3A0028_Para2_1.png,وقال تشانغ شياو جيان نائب وزير الموارد البشرية والضمان الاجتماعي إن الوزارة ستنظم
107,AHTD3A0028_Para2_2.png,ملتقيات توظيف في الجامعات وعلى شبكة الانترنت وكذلك أنشطة متنوعة لخريجي الجامعات
108,AHTD3A0028_Para2_3.png,مثل الإرشادات المهنية والخدمات الاستشارية وخدمات تأسيس المشروعات الذاتية الخ
109,AHTD3A0028_Para3_3.png,أن إنهاض آنهوي يتطلب تركيز الجهود في ثلاثة مجالات هي تحديدا إدارة المال إنشاء
110,AHTD3A0028_Para3_4.png,صوامع الحبوب جعل آنهوي فردوسا أي جعلها منطقة جذب سياحي
111,AHTD3A0030_Para2_1.png,صعدنا قمة الجبل وقت الأصيل فتألقت أمامنا روعته وكأنه لوحة رسم معلقة
112,AHTD3A0030_Para2_2.png,بالسماء الزرقاء الرائعه  تنتشر المعابد على جروف الجبل وفي أودية الجبل تمتزج
113,AHTD3A0030_Para2_4.png,المعابد البوذية أصبح جبل جيوهوا دولة زهور اللوتس البوذية وصار لوحة فنية
114,AHTD3A0030_Para2_5.png,جميلة
115,AHTD3A0030_Para3_1.png,يتكون جبل جيوهوا من حجر الجرانيت رئيسيا ويتميز بتضاريسه الغريبة
116,AHTD3A0030_Para3_3.png,الغريبة الأشكال وتتقاطع الأغدرة  على مدى أكثر من ألف عام ظل جيوهوا قبلة
117,AHTD3A0030_Para3_4.png,الأدباء والفنانين والمشاهير فتركوا فيه بصماتهم وأعمالهم  واليوم يحتفظ الجبل
118,AHTD3A0030_Para3_5.png,بأكثر من ألف كتاب للشعر والمقالات والأغاني
119,AHTD3A0031_Para2_1.png,في إحدى القصائد التي تصف الجبل نقرأ على ضفة النهر لوحات
120,AHTD3A0031_Para2_2.png,رسمها وانغ وي رسام صيني قديم وعلى أحجار الجبل قصائد
121,AHTD3A0031_Para2_3.png,شعر كتبها لي باي قبل ألف سنة  ونقرأ أيضا  في تشو مقاطعتا
122,AHTD3A0031_Para2_4.png,هونان وهوبي حاليا ويويه مقاطعة تشجيانغ حاليا آلاف من الجبال
123,AHTD3A0031_Para2_5.png,ولكن جيوهوا يجمع جمال كل هذه الجبال
124,AHTD3A0031_Para3_1.png,في أكثر فترات ازدهاره كان عدد المعابد في جبل جيوهوا أكثر من ثلاثمائة
125,AHTD3A0031_Para3_2.png,معبد  وعلى الرغم من أن جبل جيوهوا يعتبر مع جبال ووتاي وآمي وبوتوه
126,AHTD3A0031_Para3_3.png,الأربعة جبال المقدسة للبوذية في الصين فإنه الأكثر زيارة  بعد انتهاج
127,AHTD3A0031_Para3_4.png,الصين سياسة الانفتاح على الخارج في سبعينيات القرن الماضي أبرز
128,AHTD3A0031_Para3_5.png,جبل جيوهوا البوذي
129,AHTD3A0033_Para2_1.png,من أن يعرف حياة أباطرة الصين فليذهب إلى بكين ومن شاء أن يعرف حياة الشعب في زمن أسرتي مينغ
130,AHTD3A0033_Para2_2.png,وتشينغ فليس أفضل من محافظة ييشيان بمقاطعة آنهوي  تقع محافظة ييشيان بالسفح الجنوبي لجبل
131,AHTD3A0033_Para3_1.png,والحقيقة أن محافظة ييشيان بها مئات القرى القديمة وتضم أكثر من ثلاثة آلاف و سبعمائة
132,AHTD3A0033_Para3_2.png,بناية مازالت محتفظة بأشكالها الأصلية التي كانت عليها في زمن أسرتي مينغ وتشينغ  في هذه القرى القديمة
133,AHTD3A0033_Para3_3.png,تشعر أنك دخلت رواقا ممتدا للثقافة الصينية العريقة  تتميز القرى الكبيرة في محافظة ييشيان بوجود
134,AHTD3A0033_Para3_4.png,عشائر قوية  و كانت
135,AHTD3A0034_Para2_1.png,تتميز القرى الكبيرة في محافظة ييشيان بوجود عشائر قوية  وقد كانت قرية
136,AHTD3A0034_Para2_2.png,شيدي موطن عشيرة هو في حين كانت قرية هونغتسون في منطقة هويتشو
137,AHTD3A0034_Para2_3.png,موطن عشيرة وانغ  بسبب الحروب هاجرت إلى ييشيان عشائر كبيرة
138,AHTD3A0034_Para2_4.png,فزاد  عدد سكانها وضاقت بهم المساحة المحدودة من أرضها المستوية
139,AHTD3A0034_Para2_5.png,حتى بلغ شظف العيش فيها مبلغا
140,AHTD3A0036_Para2_1.png,أنها ذات جدران عالية قمتها على شكل رأس الحصان وبدون نوافذ وبها
141,AHTD3A0036_Para2_3.png,والسلامة ولكنه أيضا يخلق شعورا بالضيق إضافة إلى مشكلة
142,AHTD3A0036_Para2_4.png,التهوية والإضاءة ولهذا كان يفتح مسقط للنور وكان مسقط النور
143,AHTD3A0036_Para2_5.png,هو المنفذ الوحيد لرؤية السماء من داخل الدار
144,AHTD3A0036_Para3_1.png,يهتم أبناء هويتشو بالتعليم منذ قديم الزمان ويتجلى هذا الاهتمام في
145,AHTD3A0036_Para3_4.png,والاقتصاد واحترام وبر الوالدين والجد في الدراسة  هذه المعلقات
146,AHTD3A0036_Para3_5.png,تعتبر شعارات صاحب البيت وكتاب تعليم للأولاد
147,AHTD3A0038_Para2_1.png,المدينة القديمة متحف تاريخي ضخم يضم جسورا وأبراجا وسدودا
148,AHTD3A0038_Para2_2.png,وبوابات قديمة  ولعل بوابة شيوي قوهالتذكارية هي أكثر
149,AHTD3A0038_Para2_3.png,ما يترك انطباعا عميقا لزائر هويتشو فهذه البوابة التي
150,AHTD3A0038_Para2_4.png,تعتبر واحدة من ثلاث نوادر في  هويتشو تتكون
151,AHTD3A0038_Para2_5.png,من أربعة أعمدة وثلاثة طوابق بدون مسمار
152,AHTD3A0038_Para3_1.png,مناظر نهر شينان تجعلك أمام لوحة صينية رائعة فهي مناظر
153,AHTD3A0039_Para3_1.png,وقد بلغ عدد الذين اجتازوا منهم الامتحان الإمبراطوري على المستويين الوطني
154,AHTD3A0039_Para3_2.png,والمحلي أكثر من عشرين  وقد اشتهرت قرية لونغتشوان في هويتشو بأنها قرية جينشي
155,AHTD3A0039_Para3_3.png,أي قرية الناجحين في الامتحان الإمبراطورية  أقيم في القرية  بوابة تذكارية منها
156,AHTD3A0042_Para2_1.png,تشعر أنك في قاعة موسيقى سماوية  تشبه الموسيقى إيقاع سقوط المطر على الأفاريز
157,AHTD3A0042_Para2_2.png,أحيانا وتشبه صفير الريح التي تحف بجذور الشجر أحيانا أخرى  تكون
158,AHTD3A0042_Para2_3.png, سيمفونية أحيانا وتصبح موسيقى  فلكلورية أحيانا أخرى  هذه
159,AHTD3A0042_Para2_4.png,المقطوعات الموسيقية المتنوعة تعزفها عيون الماء والشلالات داخل الوادي  إن أجمل
160,AHTD3A0042_Para2_5.png,موسيقى هي تلك التي يعزفها الجبل والماء والحجر
161,AHTD3A0042_Para3_1.png,خلال اجتماع للجنة المركزية للحزب الشيوعي الصيني في بكين يوم  يناير  بحث
162,AHTD3A0042_Para3_2.png,الحاضرون سبل تعزيز التحديث الزراعي وقد حث الرئيس الصيني هو جين تاو وهو أيضا
163,AHTD3A0043_Para2_1.png,قال هو جين تاو أيضا إن التنمية الاقتصادية الزراعية والريفية المتواصلة
164,AHTD3A0043_Para2_4.png,لتوسيع الطلب المحلي وأن تحسين مستوى معيشة المزارعين يعد مهمة رئيسية
165,AHTD3A0043_Para2_5.png,ولكنها صعبة وطالب هو جين
166,AHTD3A0043_Para3_1.png, أولا إعطاء أهمية أكبر لأمن الحبوب في الصين وإمدادات المنتجاتالزراعية
167,AHTD3A0043_Para3_2.png,الرئيسية حيث أكد الرئيس على ضرورة أن تلتزم الصين بأكثر النظم حزما لحماية
168,AHTD3A0048_Para2_1.png,وبذلك ساهمت بشكل كبير في تعميم مفهوم الطب التقليدي
169,AHTD3A0048_Para2_2.png,الصيني بين اللبنانيين تولى التدريس في هذه الدورة الدكتور أدمون
170,AHTD3A0048_Para2_3.png,إبراهيم خريج جامعة الطب والعقاقير التقليدية الصينية ببكين الذي
171,AHTD3A0048_Para2_4.png,عاش في الصين فترة طويلة ويتكلم الصينية مثل الصينيين
172,AHTD3A0048_Para2_5.png,وهو يستطيع شرح وتدريس نظرية الطب التقليدي الصيني
173,AHTD3A0048_Para2_6.png,بالعربية والفرنسية والإنجليزية والصينية
174,AHTD3A0048_Para3_1.png,يقيم المعهد أيضا ندوات ومحاضرات متخصصة بين حين وآخر
175,AHTD3A0048_Para3_2.png,ففي  نوفمبر  ألقى سفير الصين لدى لبنان ليو تشي
176,AHTD3A0048_Para3_3.png,مينغ محاضرة بعنوان الصين الماضي والحاضر والمستقبل حول سياسة
177,AHTD3A0048_Para3_4.png,واقتصاد الصين فدشن بذلك دورة مدتها عشرون ساعة
178,AHTD3A0048_Para3_5.png,حول سياسة واقتصاد الصين في المعهد بهذا الأسلوب
179,AHTD3A0048_Para3_6.png,المتميز ينقل معهد كونفوشيوس بجامعة
180,AHTD3A0050_Para2_2.png,يوسف سان جوزيف أول معهد كونفوشيوس في الدول العربية
181,AHTD3A0051_Para2_3.png,بجامعة القاهرة ليكون أول معهد كونفوشيوس في شمالي أفريقيا
182,AHTD3A0051_Para2_4.png,في هذا المعهد يتم تدريس اللغة الصينية وإعداد مدرسي الصينية من المصريين
183,AHTD3A0051_Para2_5.png,وعقد امتحان مستوى اللغة الصينية وترشيح الطلاب المصريين
184,AHTD3A0051_Para2_6.png,للدراسة في الصين
185,AHTD3A0051_Para3_4.png,للتعاون والتبادل الثقافي والإنساني والتعليمي بين الصين ومصر
